#,الجامعة,الدولة,المدينة,الموقع الرسمي,city_fill_method
4044,Ecole des Arts Ghassan Yammine,Lebanon,,,
4045,Franco Lebanese University Technology Center of North Lebanon,Lebanon,,,
4047,Islamic University Of Lebanon,Lebanon,,,
4051,Rafik Hariri University,Lebanon,,,
4053,American International Medical University,Saint Lucia,,,
4054,College of Medicine & Health Sciences COMHS,Saint Lucia,,,
4055,Asia Pacific Institute of Information Technology Sri Lanka,Sri Lanka,,,
4058,IUHS Campus,Sri Lanka,,,
4062,United Methodist University,Liberia,,,
4066,Kolping College,Lithuania,,,
4068,Studiju kokybes vertinimo centras,Lithuania,,,
4100,Chouaib Eddoukali University,Morocco,,,
4101,ESSIC Higher School of Commercial Engineering Sciences,Morocco,,,
4106,Hassan II Ain Chock University Faculty of Dental Medicine,Morocco,,,
4111,Hassan II University Ain Chock Faculty of Letters & Human Sciences Ain Chock,Morocco,,,
4112,HECF School of Advanced Accounting & Financial Studies,Morocco,,,
4113,Hem Institute Of Advanced Management Studies,Morocco,,,
4114,HESCOM High School of Commercial Sciences,Morocco,,,
4115,Higher Institute of Management & Technology,Morocco,,,
4117,Higher School of Management & IT Sciences EGICO,Morocco,,,
4118,Higher School of Telecommunications Sup Telecom,Morocco,,,
4123,Institute of Higher Education in Management & Paramedical IESMP,Morocco,,,
4124,International Slavic University GR Derzhavin,Morocco,,,
4125,Knowledge Computer & Business Institute,Morocco,,,
4126,Mohammed First University Oujda,Morocco,,,
4131,Mohammed VI Polytechnic University School of Governance & Economics,Morocco,,,
4132,Mother Teresa University,Morocco,,,
4137,National School Of Mineral Industry,Morocco,,,
4139,"School of Commerce, Management & Private IT",Morocco,,,
4142,University for Tourism & Management Skopje,Morocco,,,
4149,Mediterranean University Montenegro,Montenegro,,,
4150,University Of Donja Gorica,Montenegro,,,
4151,"Higher School of Accounting, Administration & Business Management",Madagascar,,,
4152,Higher School of Information & Communication,Madagascar,,,
4153,American University of Myanmar,Myanmar,,,
4157,Connect Institute American University in Myanmar,Myanmar,,,
4159,Myanmar Maritime University,Myanmar,,,
4160,STI Myanmar University,Myanmar,,,
4162,University of Computer Studies Myikyina,Myanmar,,,
4163,University of Forestry & Environmental Science Yezin,Myanmar,,,
4180,University of Science Arts & Technology Faculty of Medicine,Montserrat,,,
4181,ITIS Malta Tourism Institute,Malta,,,
4183,University Of Technology Mauritius,Mauritius,,,
4185,Malawi Adventist University Malamulo Campus,Malawi,,,
4186,Millennium University,Malawi,,,
4187,Riverton University,Malawi,,,
4188,University Of Malawi College Of Medicine Liverpool Wellcome Trust,Malawi,,,
4191,American Continent University,Mexico,,,
4193,American Isthmus University,Mexico,,,
4194,American Technological University,Mexico,,,
4195,Anahuac College of Higher Studies,Mexico,,,
4198,AngloHispanoMexican University,Mexico,,,
4199,Art Institute of Higher Studies of Design,Mexico,,,
4200,Asia Pacific University,Mexico,,,
4201,Atemajac Valley University,Mexico,,,
4219,Autonomous University of the Pacific,Mexico,,,
4225,Bahia de Banderas Technological Institute,Mexico,,,
4231,Center for Higher Studies in Education,Mexico,,,
4232,Center for Higher Studies in Education CESE,Mexico,,,
4235,Center for Higher University Studies,Mexico,,,
4236,Center for Specialties in Development & Education,Mexico,,,
4237,Center for Technological & University Studies of the Gulf,Mexico,,,
4238,Centla Higher Technological Institute,Mexico,,,
4239,Ceunico University,Mexico,,,
4241,Chiapas Graduate Institute of Education,Mexico,,,
4242,China Institute of Technology,Mexico,,,
4247,Coalcoman Higher Technological Institute,Mexico,,,
4248,Columbia University Center,Mexico,,,
4249,Comitancillo Technological Institute,Mexico,,,
4250,Continental Valley University,Mexico,,,
4254,CUN College Northeastern University Center,Mexico,,,
4255,Descartes University of Science & Technology,Mexico,,,
4256,Desert University,Mexico,,,
4261,Ebony Higher Technological Institute,Mexico,,,
4263,Emmanuel Kant University Center,Mexico,,,
4268,Flacso Mexico Latin American Faculty Of Social Sciences,Mexico,,,
4270,Franco Mexican University UFRAM,Mexico,,,
4273,Galilee University,Mexico,,,
4274,Gastronomic Institute of Higher Studies,Mexico,,,
4276,Hidalgo State College,Mexico,,,
4277,Hidalgo State Music School,Mexico,,,
4279,Higher College of Gastronomy,Mexico,,,
4280,Higher Institute of Ecclesiastical Studies,Mexico,,,
4281,Higher Institute of Research & Teaching for Teaching,Mexico,,,
4287,Higher School of Sciences & Humanities,Mexico,,,
4288,Higher School of Visual Arts,Mexico,,,
4289,Higher Technological Institute of Cajeme,Mexico,,,
4303,Higher Technological Institute of the Sierra Region,Mexico,,,
4308,Ibeoamerican University,Mexico,,,
4309,Ibero-American University,Mexico,,,
4310,Iberoamerican International University,Mexico,,,
4311,Incarnate Word University Bajio Campus,Mexico,,,
4312,Institute of Higher Education in Accounting & Administration,Mexico,,,
4313,Institute of Higher Education Sciences,Mexico,,,
4314,Institute of Higher Fashion Studies Casa de Francia,Mexico,,,
4315,Institute of Higher Studies in Gastronomy IESEG,Mexico,,,
4316,Institute of Higher Tourism Studies,Mexico,,,
4318,Institute of Marketing & Advertising,Mexico,,,
4323,Inter American University Center CEUNI System,Mexico,,,
4324,Inter American University Center Southeast University,Mexico,,,
4326,Interamerican University of the North,Mexico,,,
4327,Interamerican University University of Business & Administration,Mexico,,,
4328,Intercontinental Higher Studies Center,Mexico,,,
4330,Interglobal University,Mexico,,,
4331,International Business College,Mexico,,,
4332,International Culinary School,Mexico,,,
4333,International university,Mexico,,,
4334,International University of International Higher Studies,Mexico,,,
4339,La Salle Higher Studies Center,Mexico,,,
4341,La Salle University Northwest,Mexico,,,
4343,Latin American Institute Of Educational Communication,Mexico,,,
4346,Loyola University of America,Mexico,,,
4350,Matatipac Institute of Technological & Higher Studies,Mexico,,,
4351,Mayab Technological University,Mexico,,,
4354,Metropolitan University Center,Mexico,,,
4355,Metropolitan University Institute,Mexico,,,
4356,Mexican American University Institute,Mexico,,,
4357,Mexican Institute of Pedagogical Studies Nayarit,Mexico,,,
4358,Mexican School,Mexico,,,
4359,Mexican Tourism Institute,Mexico,,,
4360,Mexican University,Mexico,,,
4363,Mexico Valley University Center,Mexico,,,
4364,Michoacan College,Mexico,,,
4367,Model University Group,Mexico,,,
4373,Narvarte University Center,Mexico,,,
4375,National College of Technical Vocational Education,Mexico,,,
4376,National Institute of Fiscal Studies,Mexico,,,
4377,National Institute of Public Administration,Mexico,,,
4378,National Institute of Public Health (INSP),Mexico,,,
4379,National Pedagogical University 213,Mexico,,,
4384,National Pedagogical University UPN Poza Rica,Mexico,,,
4386,National Pedagogical University UPN Unit 071,Mexico,,,
4388,National Pedagogical University UPN Unit 291,Mexico,,,
4389,National Pedagogical University UPN Virtual,Mexico,,,
4391,National Polytechnic Institute,Mexico,,,
4395,Northeastern American University,Mexico,,,
4396,Northeastern University & Technology College,Mexico,,,
4397,Northeastern University Center,Mexico,,,
4399,Northern Border College,Mexico,,,
4400,Northern Regional University,Mexico,,,
4403,Pan American Institute of Senior Business Management IPADE,Mexico,,,
4407,Patria University Center,Mexico,,,
4413,Polytechnic University of the Center,Mexico,,,
4417,Postgraduate College,Mexico,,,
4419,Professor Jesus Manuel Bustamante Mungarro State Normal School,Mexico,,,
4422,Puebla University Institute Yucatan Campus,Mexico,,,
4424,Quevedo University Center,Mexico,,,
4428,Saint Michael's University,Mexico,,,
4429,Salesian Institute of Higher Studies,Mexico,,,
4434,Scientific Technical & Educational Institute,Mexico,,,
4436,Sierra Technological University,Mexico,,,
4437,Sonora College,Mexico,,,
4438,Sonora State University,Mexico,,,
4439,Sonora Technological Institute,Mexico,,,
4440,Southeast Institute of Higher Studies,Mexico,,,
4441,Southeast University Institute,Mexico,,,
4442,Southern Border College,Mexico,,,
4443,Southern Regional Technological University,Mexico,,,
4444,Southern Sierra University,Mexico,,,
4445,Southern University Center CUS,Mexico,,,
4446,State University of Pedagogical Studies,Mexico,,,
4447,Swiss Hotel University,Mexico,,,
4448,Tamaulipas International Institute of Higher Studies,Mexico,,,
4460,Technological University of the Center,Mexico,,,
4462,Technological University of the Coast,Mexico,,,
4463,Technological University of the Sierra Hidalguense,Mexico,,,
4471,Tominaga Nakamoto University,Mexico,,,
4472,Uninter International University,Mexico,,,
4473,UNISO 21st Century University,Mexico,,,
4474,Universidad del Claustro de Sor Juana,Mexico,,,
4475,Universidad Politecnica de Chiapas,Mexico,,,
4476,Universidad Tangamanga S.C.,Mexico,,,
4477,University Center of Gastronomy,Mexico,,,
4479,University Center of the West,Mexico,,,
4482,University Institute of Technology & Humanities,Mexico,,,
4484,University of Advanced Studies,Mexico,,,
4491,University of International Relations & Studies,Mexico,,,
4498,University of the Center of Bajio,Mexico,,,
4499,University Of The Sea,Mexico,,,
4501,University of Veracruz UNIVER Campus Nayarit,Mexico,,,
4504,Veracruz Institute of Higher Education,Mexico,,,
4505,Veracruz Study Center,Mexico,,,
4506,Veracruzano University Institute,Mexico,,,
4507,Windsor Higher Institute of Professional Studies,Mexico,,,
4509,Zacatecas Oeste Technological Institute,Mexico,,,
4510,Zacatecas Sur Higher Technological Institute,Mexico,,,
4511,Arau Community College,Malaysia,,,
4513,Asia Metropolitan University Asia Metropolitan College,Malaysia,,,
4515,Baitulmal Professional Institute,Malaysia,,,
4516,Batu Lanchang Vocational College,Malaysia,,,
4517,Bayu College,Malaysia,,,
4518,Co Operative College of Malaysia,Malaysia,,,
4519,Community College Bookie,Malaysia,,,
4520,Cybernetics International College of Technology,Malaysia,,,
4522,DRB HICOM University of Automotive Malaysia,Malaysia,,,
4523,Eastern College,Malaysia,,,
4524,Eastern College of Technology,Malaysia,,,
4525,EU Institute,Malaysia,,,
4526,Felcra College,Malaysia,,,
4527,Gerik Community College,Malaysia,,,
4528,HELP College of Arts & Technology,Malaysia,,,
4529,How come Lanas Community College,Malaysia,,,
4530,IBS College,Malaysia,,,
4532,Insaniah University College,Malaysia,,,
4533,Institute of Science & Management,Malaysia,,,
4534,"Institute of Teacher Education, Pulau Pinang Campus",Malaysia,,,
4535,International College of Technology & Professional,Malaysia,,,
4536,International Institute of Science Mantin,Malaysia,,,
4537,International Islamic University College Selangor,Malaysia,,,
4540,International Open College,Malaysia,,,
4542,KDU Penang University College,Malaysia,,,
4543,KDU University College,Malaysia,,,
4545,Kuala Klawang Vocational College,Malaysia,,,
4546,Kuala Langat Community College,Malaysia,,,
4548,Lincoln University College Malaysia,Malaysia,,,
4549,MAHSA Avenue International College MPIC,Malaysia,,,
4550,Malay Campus Teacher Education Institute,Malaysia,,,
4551,Manipal International University,Malaysia,,,
4554,MCS College,Malaysia,,,
4555,MEA College of Technology,Malaysia,,,
4556,Melaka Tengah Vocational College,Malaysia,,,
4557,National Defense University Of Malaysia,Malaysia,,,
4559,Netherlands Maritime Institute of Technology,Malaysia,,,
4560,Newbridge College,Malaysia,,,
4561,NIIT College,Malaysia,,,
4562,Pelandar Community College,Malaysia,,,
4563,Penang Medical College,Malaysia,,,
4565,Pintar College,Malaysia,,,
4566,Point College,Malaysia,,,
4569,SC College,Malaysia,,,
4570,Shahputra University College,Malaysia,,,
4571,Sultan Azlan Shah Islamic University College,Malaysia,,,
4572,Sultan Azlan Shah University USAS,Malaysia,,,
4573,Sungai Tanjung 2 Vocational College,Malaysia,,,
4575,Technical University Of Malaysia Melaka,Malaysia,,,
4576,Terra College,Malaysia,,,
4580,Unitar International University,Malaysia,,,
4581,Universiti Antarabangsa Tunku UniTunku,Malaysia,,,
4584,University College of Technology Sarawak,Malaysia,,,
4585,University Islam Pahang Sultan Ahmad Shah,Malaysia,,,
4595,Vinayaka Missions International University College,Malaysia,,,
4596,Vision College,Malaysia,,,
4597,Catholic University Of Mozambique,Mozambique,,,
4603,College of Education Thanksgiving,Nigeria,,,
4605,Dominion University,Nigeria,,,
4607,Elizade University Ilara Mokin,Nigeria,,,
4608,Federal College of Education Contagora,Nigeria,,,
4609,Federal College of Education Protectors,Nigeria,,,
4616,Federal University Otuoke Bayelsa,Nigeria,,,
4620,Ignatius Ajuru University of Education Rumuoumeni,Nigeria,,,
4622,Kebbi State University Kebbi,Nigeria,,,
4629,Polytechnic Tower,Nigeria,,,
4630,Rivers State College of Arts & Science Rumuola,Nigeria,,,
4637,American College University,Nicaragua,,,
4639,Annunciata University,Nicaragua,,,
4640,Central American University of Business Sciences,Nicaragua,,,
4641,Centroamerican University,Nicaragua,,https://uca.edu.ni/,
4642,International University of the Integration of Latin America UNIVAL,Nicaragua,,,
4643,John Paul II Catholic University,Nicaragua,,,
4644,La Salle Technological University,Nicaragua,,,
4645,Martin Luther University,Nicaragua,,,
4646,Metropolitan University,Nicaragua,,,
4647,National Agrarian University,Nicaragua,,,
4650,Polytechnic University Of Nicaragua,Nicaragua,,,
4652,Technical University of Commerce,Nicaragua,,,
4653,The American University,Nicaragua,,,
4654,University of Technology & Commerce,Nicaragua,,,
4655,Vitoria UTV Technological Institute,Nicaragua,,,
4658,Artez Hogeschool Voor De Kunsten,Netherlands,,,
4659,Avans University Of Professional Education,Netherlands,,,
4660,CAH Vilentum Dronten & Almere,Netherlands,,,
4662,Cruyff Institute for Sport Studies,Netherlands,,,
4665,Gerrit Rietveld Academie,Netherlands,,,
4668,ITV College,Netherlands,,,
4669,Netherlands School of Primary Care Research,Netherlands,,,
4670,Nti Distance Education,Netherlands,,,
4671,Openuniversity,Netherlands,,,
4673,Rotterdams Conservatorium,Netherlands,,,
4675,Schumann Academy University of Professional Education,Netherlands,,,
4676,SDO University of Applied Sciences Part time Training Foundation,Netherlands,,,
4680,University For Humanistics,Netherlands,,,
4681,University of Professional Education in Midwifery,Netherlands,,,
4685,Van Hall Larenstein,Netherlands,,,
4690,Wittenborg Business University,Netherlands,,,
4692,Bjorknes College,Norway,,,
4693,Buskerud & Vestfold University College,Norway,,,
4697,Lovisenberg Diaconal University College,Norway,,,
4698,Mf Norwegian School Of Theology,Norway,,,
4700,NKI Online studies,Norway,,,
4701,Nord Trondelag University College,Norway,,,
4707,Parish & Fjordane University College,Norway,,,
4708,Sor Trondelag University College,Norway,,,
4713,Aoraki Polytechnic,New Zealand,,,
4715,International Pacific College,New Zealand,,,
4718,Linguis International Institute,New Zealand,,,
4721,Universal College Of Learning,New Zealand,,,
4723,Whitireia Polytechnic,New Zealand,,,
4724,German University Of Technology In Oman,Oman,,,
4725,Higher College Of Technology,Oman,,,
4727,Mazoon College for Management & Applied Sciences,Oman,,,
4728,Mazoon University College,Oman,,,
4729,Nizwa College Of Technology,Oman,,,
4731,University Of Buraimi,Oman,,,
4742,Antonio Ruiz De Montoya University,Peru,,,
4743,Autonomous University of Peru,Peru,,,
4744,Catholic University Headquarters Sapientiae,Peru,,,
4748,Continental University,Peru,,,
4750,Eastern Peruvian University,Peru,,,
4753,Inter American University for Development,Peru,,,
4754,John Paul II Private University,Peru,,,
4756,Leonardo Da Vinci Private University,Peru,,,
4758,Lord Of Sipan University,Peru,,,
4759,Micaela Bastidas National University Of Apurimac,Peru,,,
4775,National University Of The Peruvian Amazon,Peru,,,
4778,Neumann Business School Graduate School,Peru,,,
4780,Northern Private University,Peru,,,
4781,Peruvian Union University,Peru,,,
4782,Peruvian University of Sciences & Informatics,Peru,,,
4783,Peruvian University Of The Andes,Peru,,,
4784,Peruvian University of the Center,Peru,,,
4786,Private Autonomous University of the South,Peru,,,
4789,Sacred Heart Female University,Peru,,,
4794,Southern Scientific University,Peru,,,
4795,St Andrew's University,Peru,,,
4796,Technological University Of Peru,Peru,,,
4797,Toribio Rodriguez National University Of Mendoza Of Amazonas,Peru,,,
4806,Charles Yarn Memorial State College,Philippines,,,
4807,College of Sta Catherine of Alexandria,Philippines,,,
4811,Holy Trinity University Philippines,Philippines,,,
4813,Mater Dei College Bohol,Philippines,,,
4814,Misamis Oriental State College of Agriculture & Technology,Philippines,,,
4815,MSC Institute of Technology,Philippines,,,
4816,New Vizcaya State University,Philippines,,,
4817,Northeastern College,Philippines,,,
4819,Pampanga Agricultural College,Philippines,,,
4821,Saint Joseph Institute of Technology,Philippines,,,
4824,Southville SISFU,Philippines,,,
4826,St Charles College,Philippines,,,
4828,St Joseph's College,Philippines,,,
4829,St Louis St Mary's College,Philippines,,,
4830,St Paul Colleges St Paul City Laguna,Philippines,,,
4831,St Peter's College,Philippines,,,
4832,St Vincent's College,Philippines,,,
4833,STI West Negros University,Philippines,,,
4834,Union Christian College,Philippines,,,
4836,University of Science & Technology,Philippines,,,
4839,Western Mindoro State College,Philippines,,,
4840,Balochistan Institute of Information Technology & Management Sciences,Pakistan,,,
4841,Barret Hodgson University,Pakistan,,,
4842,Brains Post Graduate College,Pakistan,,,
4844,College of Business & Information Technology,Pakistan,,,
4845,COMMECS Institute of Businness Education,Pakistan,,,
4848,Fatima Jinnah Medical College,Pakistan,,,
4857,Institute of Computer & Management Sciences,Pakistan,,,
4859,Institute of Information Technology & Management,Pakistan,,,
4864,Jinnah Institute,Pakistan,,,
4869,Liaquat College of Management & Science,Pakistan,,,
4871,Murray College,Pakistan,,,
4878,NWFP University of Engineering & Technology,Pakistan,,,
4879,Pakistan Educational Foundation College,Pakistan,,,
4880,Qalandar Shahbaz University of Modern Sciences,Pakistan,,,
4883,Sir Sayyed College of Arts Commerce & Science,Pakistan,,,
4885,Tech Era College of Sciences & IT,Pakistan,,,
4895,Akademia Kupiecka,Poland,,,
4904,European University of Business,Poland,,,
4912,Henryk Niewodniczański Institute of Nuclear Physics,Poland,,,
4929,Higher School of Management in Biatystok,Poland,,,
4934,Higher School of Universal Education,Poland,,,
4940,Karkonosze Academy of Applied Sciences,Poland,,,
4941,Lazarski University,Poland,,,
4943,Lower Silesian College of Public Services Asesor in Wroctaw,Poland,,,
4956,Nicolaus Copernicus Astronomical Center of the Polish Academy of Sciences,Poland,,,
4967,PWST National Academy of Theater Arts Cracow Branch Wroclau,Poland,,,
4978,State Academy of Applied Sciences in Chetm,Poland,,,
4983,State Vocational University in Wtoctawek,Poland,,,
4984,State Vocational University of prof. Edward F Szczepanik in Suwatki,Poland,,,
4987,Tadeusz Kosciuszko Cracow University Of Technology,Poland,,,
4990,Technical University Of Fire Service,Poland,,,
4997,University of Humanities & Economics in Wtoctawek,Poland,,,
4998,University of Information Technology & Management Copernicus in Wroctaw,Poland,,,
5018,Wroctaw College of Management & Finances,Poland,,,
5019,Wsb School Of Banking,Poland,,,
5022,Antillean Adventist University,Puerto Rico,,,
5024,Center for Multidisciplinary Studies,Puerto Rico,,,
5028,Puerto Rico Conservatory Of Music,Puerto Rico,,,
5029,Sacred Heart University,Puerto Rico,,,
5031,St John's Metropolitan University,Puerto Rico,,,
5035,University Of Puerto Rico Rio Piedras,Puerto Rico,,,
5039,Jerusalem College Of Engineering,Palestine,,,
5040,ORT Braude College of Engineering,Palestine,,,
5041,Palestine Technical College Deir El Balah,Palestine,,,
5043,Peres Academic Center,Palestine,,,
5046,University of Independence,Palestine,,,
5049,Air Force Academy,Portugal,,,
5050,Autonomous Higher Institute of Polytechnic Studies,Portugal,,,
5054,Egas Moniz Higher School Of Health,Portugal,,,
5055,Escola Superior de Estudos de Artes Decorativas ESAD,Portugal,,,
5057,Higher Institute Of Applied Psychology,Portugal,,,
5058,Higher Institute of Education & Sciences,Portugal,,,
5059,Higher Institute Of Educational Sciences,Portugal,,,
5063,Infante Dom Henrique Nautical School,Portugal,,,
5065,"Institute of Visual Arts, Design & Marketing",Portugal,,,
5073,Northern Health School of the Portuguese Red Cross,Portugal,,,
5084,UNI Independent University,Portugal,,,
5090,University Of The Azores,Portugal,,,
5092,Vasco Da Gama University School,Portugal,,,
5095,Catholic University Of Our Lady Of The Assumption,Paraguay,,,
5096,Columbia University Of The Philippines,Paraguay,,,
5097,Hernando Arias de Saavedra Higher University,Paraguay,,,
5099,National University Of Italy,Paraguay,,,
5101,National University of Villarica of the Holy Spirit,Paraguay,,,
5102,Private University of the East,Paraguay,,,
5104,City College Qatar,Qatar,,,
5105,College of the North Atlantic Qatar,Qatar,,,
5109,Christian University Dimitrie Cantemir,Romania,,,
5110,December 1918 University,Romania,,,
5111,George Enescu University Of Arts,Romania,,,
5112,National University Of Fine Arts,Romania,,,
5120,University Babes Bolyai,Romania,,,
5128,European Vision University,Serbia,,,
5129,Faculty of Islamic Studies,Serbia,,,
5130,Gjilani College,Serbia,,,
5131,Globus International Management College,Serbia,,,
5136,Union University Faculty of Law,Serbia,,,
5137,University College,Serbia,,,
5144,Baikal Institute of Economics & Law,Russia,,,
5147,Bashkir State Pedagogical University M Akmully,Russia,,,
5165,Branch of the Ural Federal State University Alapaevske,Russia,,,
5173,Buryat State Agricultural Academy,Russia,,,
5180,Dagestan State Institute of National Economy,Russia,,,
5181,Dagestan State Medical Academy,Russia,,,
5184,Daghestan State Technical University,Russia,,,
5185,Dalrybvtuz Far Eastern State Technical University Of Fisheries,Russia,,,
5186,Don State University Of Agriculture,Russia,,,
5188,Economics & Power Engineering Institute,Russia,,,
5190,Far East State Agrarian University,Russia,,,
5191,Far East State Medical University,Russia,,,
5193,Far Eastern Institute of Communications,Russia,,,
5194,Far Eastern Institute of International Relations,Russia,,,
5195,Far Eastern Law Institute Ministry of Internal Affairs of the Russian Federation,Russia,,,
5196,Far Eastern State Academy,Russia,,,
5197,Far Eastern State Humanities University,Russia,,,
5198,Far Eastern State University Of Railway Transport,Russia,,,
5200,Frontier Academy of Federal Security Service of the Russian Federation,Russia,,,
5203,Higher School of Religion & Philosophy,Russia,,,
5204,Institute for Nuclear Research of the Russian Academy of Sciences,Russia,,,
5205,Institute of Applied Physics of the Russian Academy of Sciences,Russia,,,
5206,Institute of Business & Economics,Russia,,,
5208,"Institute of Design, Applied Arts & Humanitarian Education",Russia,,,
5210,Institute of Education & Science,Russia,,,
5211,Institute of Finance & Law,Russia,,,
5212,"Institute of Finance, Economics & Law Officers Reserve",Russia,,,
5213,Institute of International Relations,Russia,,,
5214,Institute of Jurisprudence & Management of all Russian Police Association,Russia,,,
5215,Institute of Legal Economics,Russia,,,
5216,Institute of Management Economics & Innovation,Russia,,,
5218,Institute of Modern Management & Business,Russia,,,
5219,Institute of Open Education,Russia,,,
5220,Institute of Russian Theatre,Russia,,,
5221,Institute of Solid State Physics of the Russian Academy of Sciences,Russia,,,
5222,Institute of Technology,Russia,,,
5223,Institute of World Economy & Information IWEI,Russia,,,
5224,International Academy of Business & Management,Russia,,,
5225,International Business School of Financial University under the Government of the Russian Federation,Russia,,,
5226,International Institute of Business Information Technology & Finance,Russia,,,
5227,International Jewish Institute of Economy Finance & Law,Russia,,,
5228,International Law Institute Ministry Of Justice Of The Russian Federation,Russia,,,
5257,Kuban Institute Informzaschita,Russia,,,
5258,Kuban Social & Economic Institute,Russia,,,
5269,M.M. Shemyakin and Y.A. Ovchinnikov Institute of Bioorganic Chemistry of the Russian Academy of Sciences,Russia,,,
5275,Middle University,Russia,,,
5276,Military Academy of Army Air Defence A M Vasilevsky,Russia,,,
5327,National Institute of Business,Russia,,,
5330,Neftekamsky Branch of Bashkir State University,Russia,,,
5334,North Caucasian Institute for Social,Russia,,,
5335,North Caucasian Institute of Business Engineering & Information Technology,Russia,,,
5338,North Caucasus State Academy,Russia,,,
5339,North Ossetian State Pedagogical Institute,Russia,,,
5342,Northwest Institute,Russia,,,
5352,Orlovsky Law Institute Ministry of Internal Affairs of the Russian Federation,Russia,,,
5354,Pacific State Medical University,Russia,,,
5368,Rostov Social & Economic Institute,Russia,,,
5370,Russian Academy of Justice,Russia,,,
5373,Russian Legal Academy of the Ministry of Justice,Russia,,,
5374,Russian Medical Military Academy,Russia,,,
5413,Service Institute & tourism Don State Technical University,Russia,,,
5416,Siberian Institute of Law Economics & Management,Russia,,,
