#,الجامعة,الدولة,المدينة,الموقع الرسمي,city_fill_method
2747,STIE STIE Widyadarma Kotamobagu College of Economics,Indonesia,,,
2749,STIE Triguna College of Economics,Indonesia,,,
2751,STIE Wiyatamandala College of Economics,Indonesia,,,
2752,STIE YPLS Lamappeonro College of Economics,Indonesia,,,
2753,STIEKOM North Sumatra Academy of Informatics & Computer Management,Indonesia,,,
2754,STIEM Jakarta Muhammadiyah College of Economics,Indonesia,,,
2758,STIH Zainul Hasan College of Law,Indonesia,,,
2761,STIKES Aufa Royhan College of Health Sciences,Indonesia,,,
2764,STIKES Bina Nusantara College of Health Sciences,Indonesia,,,
2765,STIKES Citra Delima Bangka Belitung College of Health Sciences,Indonesia,,,
2768,STIKES Darul Azhar College of Health Sciences,Indonesia,,,
2770,STIKES IBNU Siina College of Health Sciences,Indonesia,,,
2772,STIKES Kusuma Husada College of Health Sciences,Indonesia,,,
2773,STIKES Mitra Bunda Persada College of Health Sciences,Indonesia,,,
2774,STIKES Mitra Bunda Persada School of Health Sciences,Indonesia,,,
2775,STIKES Mitra Kencana College of Health Sciences,Indonesia,,,
2777,STIKES Muhammadiyah Pringsewu College of Health Sciences,Indonesia,,,
2780,STIKES Nusantara College of Health Sciences,Indonesia,,,
2789,STIKOM National Dynamics College of Communication Sciences,Indonesia,,,
2792,STISIP Biges College of Social & Political Sciences,Indonesia,,,
2797,STIT Al Khairiyah Cilegon Tarbiyah College of Science,Indonesia,,,
2801,STKIP Bina Bangsa Getsempena College of Teacher Training & Education,Indonesia,,,
2803,STKIP Muhammadiyah Bangka Belitung,Indonesia,,,
2806,STKIP Pakare Talino Teacher Training & Education College,Indonesia,,,
2808,STKIP Pasundan Teacher Training & Education College,Indonesia,,,
2809,STKIP Setia Budhi Rangkasbitung Teacher Training & Education College,Indonesia,,,
2811,"STKIP Teacher Training & Education College, Banten Site",Indonesia,,,
2816,STMIK Bidakara,Indonesia,,,
2820,STMIK GICI,Indonesia,,,
2822,STMIK Ibbi College of Information & Computer Management,Indonesia,,,
2825,STMIK Jayakarta College of Information & Computer Management,Indonesia,,,
2826,STMIK Kharisma Karawang College of Information & Computer Management,Indonesia,,,
2829,STMIK Muhammadiyah Banten School of Information & Computer Management,Indonesia,,,
2833,STMIK Satyagama College of Information & Computer Management,Indonesia,,,
2840,STP Satya Widya Tourism College,Indonesia,,,
2841,STPI Curug Indonesian Aviation College,Indonesia,,,
2843,STT Bina Tunggal College of Technology,Indonesia,,,
2846,STT Gamaliel,Indonesia,,,
2847,STT Reformed Indonesia,Indonesia,,,
2848,STTI Indonesian College of Technology,Indonesia,,,
2852,Sunan Giri University,Indonesia,,,
2862,Suryakancana University,Indonesia,,,
2866,Tamansiswa Bachelor University,Indonesia,,,
2869,Tribhuwana Tunggadewi University,Indonesia,,,
2874,Uin Smh Banten State Islamic University,Indonesia,,,
2882,University Of Islam,Indonesia,,,
2886,University Of West Sulawesi,Indonesia,,,
2887,UNY FE Crystal Research UKMF,Indonesia,,,
2891,Wahid Hasyim University Unwahas,Indonesia,,,
2893,Widya Husada Periodic AKPER Nursing Academy,Indonesia,,,
2895,Widya Kartika University,Indonesia,,,
2899,WIDYA NUSANTARA AKPARTA Tourism Academy,Indonesia,,,
2902,Winaya Mukti University,Indonesia,,,
2903,Wiralodra University Unwir,Indonesia,,,
2904,Yamasi Pharmacy Academy,Indonesia,,,
2907,YKPN Polytechnic,Indonesia,,,
2912,YPIQ West Sumatra Islamic College,Indonesia,,,
2914,City Colleges,Ireland,,,
2917,ICD Business School,Ireland,,,
2919,Irish Management Institute,Ireland,,,
2924,National University Of Ireland Nui Galway,Ireland,,,
2926,Royal Irish Academy Of Music,Ireland,,,
2928,The Grafton Academy of Fashion Design,Ireland,,,
2934,Adhiparasakthi Agricultural & Horticultural College,India,,,
2936,AIGA The Asian Institute of Gaming & Animation,India,,,
2937,Al Ameer College of Engineering & IT,India,,,
2949,Anchor College,India,,,
2950,Anjuman College,India,,,
2953,Ansal Institute of Technology,India,,,
2954,Ansal Institute of Technology & Management,India,,,
2958,Apollo College,India,,,
2959,Apollo Priyadarshanam Institute of Technology,India,,,
2960,Appasaheb Birnale College of Pharmacy,India,,,
2961,Applied College of Management & Engineering,India,,,
2962,Aquinas College,India,,,
2964,Arunai College of Engineering,India,,,
2965,Arunodaya College,India,,,
2966,Arya College of Engineering & Research Center,India,,,
2974,Atmiya Institute of Technology & Science,India,,,
2975,Audisankara Institute of Technology,India,,,
2976,AVANTHI Educational Portal,India,,,
2977,AVC College,India,,,
2979,Avuthu Ammi Reddy & Bonthu Malla Reddy Degree College,India,,,
2980,Axis College of Engineering & Technology,India,,,
2981,Azad Institute of Aeronautics & Engineering,India,,,
2982,B Pant Institute of Technology,India,,,
2983,Babasaheb Gawde Institute of Management Studies,India,,,
2984,Babu Banarasi Das College of Dental Sciences,India,,,
2986,Bajkul Milani College,India,,,
2987,Balaji Institute of Engineering & Management Sciences,India,,,
2988,Balaji Institute of Management,India,,,
2989,Balaji Institute of Technology,India,,,
2990,Banipur Mahila Mahavidyalaya,India,,,
2991,Baptist Theological Seminary,India,,,
2992,Barapada School of Engineering & Technology,India,,,
2993,Basaveshwara College,India,,,
2995,Bengal College of Engineering & Technology for Women,India,,,
3002,Biju Patnaik Institute of Information Technology & Management Studies BBA,India,,,
3003,Birla College of Arts Science & Commerce,India,,,
3008,BVC Institute of Technology & Science,India,,,
3011,Career Point Universe,India,,,
3012,CBIT College of Engineering,India,,,
3013,Center for Development Economic Studies CDES,India,,,
3015,Centurion University,India,,,
3016,Chandidas College,India,,,
3017,Chaudhari Technical Institute MBA,India,,,
3018,Chaudhary Devi Lal State Institute of Engineering & Technology,India,,,
3019,Chidambaram Pillai College for Women,India,,,
3021,Christ College of Engineering,India,,,
3022,Christian Medical College,India,,,
3023,Chundi Ranganayakulu College,India,,,
3024,Chundi Senior Polytechnic,India,,,
3025,Ciet Institute of Technology & Engineering,India,,,
3027,CMR College of Engineering & Technology,India,,,
3028,CMR College of Engineering & Technology MBA,India,,,
3029,CMR Institute of Management & Technology,India,,,
3032,Cooperative Institute of Technology Vadakara,India,,,
3034,CPA College of Arts and Science,India,,,
3035,Crescent Campus,India,,,
3036,Crescent College of Technology,India,,,
3037,CSA University,India,,,
3039,CVSR College of Engineering,India,,,
3040,DAV College of Engineering & Technology,India,,,
3046,Desh Bhagat Institute of Engineering & Management,India,,,
3047,Dhanalakshmi Srinivasan Institute of Research & Technology,India,,,
3048,Dhanalakshmi Srinivasan Teacher Training Institute,India,,,
3051,Disha Education Society Disha College,India,,,
3052,Don Bosco Technical Institute,India,,,
3053,Dr Ambedkar Memorial Institute of Information Technology & Management Science,India,,,
3054,Dr B C Roy Polytechnic,India,,,
3058,Dr BR Ambedkar College Betai,India,,,
3061,Dr K N Modi institute of Engineering & Technology,India,,,
3063,Dr Vithalrao Vikhe Patil College Of Engineering,India,,,
3065,Dr. Ambedkar Government Law College Pudupakkam,India,,,
3066,DRK Institute of Science & Technology,India,,,
3067,Dwarka Dass Memorial Sai Institute,India,,,
3068,Einstein Colleges,India,,,
3070,Faith Baptist Bible College & Seminary,India,,,
3073,G Reddy College of Engineering & Technology,India,,,
3074,Gandhi Institute for Education & Technology,India,,,
3075,Gandhi Institute of Industrial Technology Brahampur Odisha,India,,,
3078,Gnanamani College of Engineering,India,,,
3079,Gokhale Memorial Girls' College,India,,,
3089,Government Model Science College,India,,,
3091,Govindadasa College,India,,,
3092,Grant Medical College & Sir J.J. Group of Hospitals,India,,,
3094,Gurukul Vidyapeeth Institute of Management & Engineering,India,,,
3098,Harcourt Butler Technological Institute,India,,,
3100,Haryana Vishwakarma Skill University,India,,,
3102,Hill College Tadubi,India,,,
3103,Hindu College,India,,,
3104,Hindustan College of Engineering,India,,,
3105,Hitech College of Engineering & Technology,India,,,
3106,HMCT Don Bosco College,India,,,
3107,Holy Kings College of Engineering & Technology,India,,,
3108,I C College of Technology,India,,,
3109,I2IT Centre of Excellence for Advanced Education & Research,India,,,
3110,IEM Management College,India,,,
3111,IILM College of Management Studies,India,,,
3113,Indian Institute for Production Management IIPM Kansbahal,India,,,
3114,Indian Institute of Crop Processing Technology,India,,,
3115,Indian Institute of Finance & Management,India,,,
3123,Indian Railways Institute of Mechanical & Electrical Engineering,India,,,
3124,Indian School OF Business & Finance,India,,,
3125,Indian School of Mines University,India,,,
3127,Indira Gandhi Medical College,India,,,
3129,Indira Kala Sangeet University,India,,,
3131,Indraprastha College of Management & Technology,India,,,
3132,Indus Business Academy,India,,,
3133,Institute for Integrated Learning in Management,India,,,
3134,Institute for Studies in Industrial Development ISID,India,,,
3136,Institute of Engineering & Technology,India,,,
3140,Institute of Management,India,,,
3143,Integral University Distance Education,India,,,
3144,International Institute of Management & Human Resource Development IIMHRD,India,,,
3147,Jamal Mohamed College,India,,,
3148,Jamia Nusrath,India,,,
3149,Janapada University,India,,,
3150,Jawaharlal Nehru Medical College,India,,,
3151,Jayawantrao Sawant College of Engineering JSPM,India,,,
3152,JECRC UDML College of Engineering,India,,,
3154,JEPPIAAR SRR Engineering College,India,,,
3155,Jhanji Hemnath Sarma College,India,,,
3156,John College,India,,,
3159,Jyothishmathi College of Engineering & Technology,India,,,
3160,Jyothishmathi Institute of Technological Sciences,India,,,
3161,K Modi University,India,,,
3162,K R Engineering College,India,,,
3164,Kandula Obul Reddy Memorial College of Engineering,India,,,
3172,KENT Institute of Higher Education,India,,,
3173,Khallikote Autonomous College,India,,,
3174,KIT Kalasalingam Institute of Technology,India,,,
3179,KM Kundnani College of Pharmacy,India,,,
3180,KMP College of Engineering,India,,,
3181,Kohinoor International Management Institute,India,,,
3183,Kongu College of Arts & Science Dheeran,India,,,
3185,Kongunadu Arts & Science College,India,,,
3186,Kovai Medical Center Research & Educational Trust,India,,,
3187,Krishna Engineering College,India,,,
3189,Kristu Jayanti College,India,,,
3191,L B S Engineering College,India,,,
3192,L E Society's Polytechnic,India,,,
3193,L N College of Information Technology,India,,,
3196,Lal Bahadur Shastri Institute of Management & Technology,India,,,
3198,Leopard Hill Global Learning,India,,,
3199,Lingaya's Institue of Health Science,India,,,
3200,Lord Krishna College of Engineering,India,,,
3201,Loyola College,India,,,
3202,M Jacob Memorial Government College Manimalakunnu,India,,,
3203,M S Institute of Technology & Management,India,,,
3205,Magna College of Engineering,India,,,
3207,Maharaja Agrasen College of Engineering & Technology,India,,,
3208,Maharaja Agresen Institute of Technology MAIT,India,,,
3209,Maharashtra Institute of Technology,India,,,
3215,Mahatma Gandhi College,India,,,
3216,Mahaveer Institute of Science & Technology MIST,India,,,
3217,Mahaveer Institute of Technology & Science,India,,,
3218,Mahindra Ecole Centrale,India,,,
3219,Makhanal Chaturvedi Rastriya Patrakarita Evam Sanchar Vishwavidyalaya,India,,,
3220,Malabar Institute of Technology,India,,,
3221,Malla Reddy College of Engineering,India,,,
3222,Malla Reddy College of Engineering & Technology MRCET,India,,,
3224,Manav Rachna College of Engineering,India,,,
3227,Mannar College,India,,,
3229,Mar Baselios Institute of Technology,India,,,
3230,Mar Thoma College MTCC,India,,,
3232,Marymatha Major Seminary,India,,,
3233,Matha College of Technology,India,,,
3234,Matrusri Institute of P G College,India,,,
3235,Maulana Azad College,India,,,
3236,Maynaguri College,India,,,
3237,MCE College,India,,,
3239,MediaOne Academy of Communication,India,,,
3240,Medical College Hospital India,India,,,
3241,Meenakshi Dental College & Hospital,India,,,
3244,Modinagar Institute of Technology,India,,,
3245,Mohammed Sathak College of Arts & Science,India,,,
3246,MR Degree College,India,,,
3247,Multani Mal Modi College,India,,,
3248,Muthayammal College of Engineering,India,,,
3249,Muthayammal Educational Institution,India,,,
3250,Muthayammal Memorial College of Arts & Science,India,,,
3252,N College of Engineering & Technology,India,,,
3253,N M Institute of Technology,India,,,
3254,Nadar Saraswathi College of Engineering & Technology NSCET,India,,,
3255,Nar Bahadur Bhandari Government College Tadong,India,,,
3256,Narasaraopeta Institute of Technology,India,,,
3257,Narayana Engineering College,India,,,
3258,Narendra Deva University of Agricultural & Technology,India,,,
3262,Nehru Gram Bharati Deemed University,India,,,
3263,Netaji Subhas College,India,,,
3264,New Horizon Institute of Technology & Management NHITM,India,,,
3265,NIE Institute of Technology,India,,,
3268,NIT College,India,,,
3270,NMS Kamaraj Polytechnic,India,,,
3271,Nopany Institute of Healthcare Studies,India,,,
3273,NRI Academy of Sciences,India,,,
3274,Paavai College of Engineering,India,,,
3275,Panimalar Polytechnic College,India,,,
3276,Pavai College of Technology,India,,,
3277,Pavendar Bharathidasan Institute of Information & Technology,India,,,
3278,Pazhassiraja College Pulpally,India,,,
3279,PDA College of Engineering Kalaburagi,India,,,
3280,PDM College of Engineering,India,,,
3281,PDM Polytechnic,India,,,
3282,PGDAV College,India,,,
3283,Picasso Animation College,India,,,
3285,Pioneer College,India,,,
3286,Pondicherry Technological University,India,,,
3287,Pope John Paul II College of Education,India,,,
3288,Postgraduate Institute of Medical Education and Research,India,,https://pgimer.nic.in/,
3289,Prasannadeb Women's College,India,,,
3292,Priyadarshi College of Engineering Sullurpeta,India,,,
3293,Priyadarshini College of Engineering,India,,,
3296,Prof Ram Meghe Institute of Technology & Research MITRA,India,,,
3297,Prof Rama Reddy College of Engineering & Technology,India,,,
3298,PSIT College of Engineering,India,,,
3300,Purushottam Institute of Engineering & Technology Rourkela,India,,,
3301,PVP College,India,,,
3302,Pydah College of Engineering & Technology,India,,,
3304,Quantum Global Campus,India,,,
3305,R C M College of Business Administration,India,,,
3306,R Engineering College PREC,India,,,
3307,R M University,India,,,
3308,R Patil College,India,,,
3309,R S College of Engineering & Technology,India,,,
3311,Raj Engineering College,India,,,
3313,Rajasthan Aryan Arts Shri Mithulalji Kacholiya Commerce & Shri Satyanarayanji Ramkrishnaji Rathi Science College,India,,,
3314,Rajasthan Institute of Engineering & Technology,India,,,
3318,Raksha Shakti University,India,,,
3319,Ramanujan College,India,,,
3320,Rattana Business Administration College,India,,,
3322,RNG Patel Institute of Technology,India,,,
3325,RVS Homoeopathic Medical College & Hospital,India,,,
3328,S M College of Engineering,India,,,
3329,S Patel Polytechnic,India,,,
3330,Sabarmati University,India,,,
3332,Saint Mary's College,India,,,
3334,Sana College of Pharmacy,India,,,
3339,Saraswathy College of Engineering & Technology SCET,India,,,
3340,SASTRA,India,,,
3341,Sathyabama Deemed University,India,,,
3343,SCAD Institute of Technology,India,,,
3344,Seshachala Institute of Technology,India,,,
3345,Seshadripuram Commerce College,India,,,
3349,Shri Ramswaroop Memorial College of Management,India,,,
3350,Shri Shankarlal Sundarbai Shasun Jain College for Women,India,,,
3351,Shri Vaishnav Institute of Management SVIM,India,,,
3353,Shyampur Siddheswari Mahavidyalaya,India,,,
3354,Sikkim Professional University,India,,,
3355,Silver Oak College of Engineering & Technology,India,,,
3356,Sir CR Reddy College Eluru,India,,,
3357,Sir J C Bose School of Engineering,India,,,
3359,Sir Vishveshwaraiah Institute of Science & Technology,India,,,
3361,Sree Anjaneya Institute of Dental Sciences SAIDS,India,,,
3362,Sree Chaitanya College,India,,,
3363,Sree Narayana College,India,,,
3364,Sree Sastha College of Engineering,India,,,
3365,Sree Sowdambika College of Engineering,India,,,
3366,Sree Venkateswara College SVCN,India,,,
3367,Sree Vidyanikethan Engineering College SVEC,India,,,
3369,Sri Annamachrya Institute of Technology & Sciences,India,,,
3370,Sri Indu Institute of Engineering & Technology,India,,,
3371,Sri Jay Dev College of Pharmaceutical Sciences,India,,,
3372,Sri Krishnadevaraya University Online,India,,https://skuniv.ap.nic.in/,
3379,Sri Taralabalu Jagadguru Institute of Technology,India,,,
3382,Sri Venkateswara Institute of Science & Information Technology,India,,,
3383,Sri Venkateswara Medical College,India,,,
3384,Srinivasa Institute of Engineering & Technology,India,,,
3385,Srinivasan Engineering College Thuraiyur,India,,,
3386,SRM TRP Engineering College,India,,,
3387,SRM Valliammai Engineering College,India,,,
3389,St Anns College for Women,India,,,
3390,St Francis' College,India,,,
3391,St George's College Aruvithura,India,,,
3393,St John's College,India,,,
3394,St Joseph College of Arts & Commerce College,India,,,
3395,St Joseph College of Engineering,India,,,
3397,St Joseph’s College of Business Administration,India,,,
3398,St Joseph's Colleges,India,,,
3399,St Paul’s Cathedral Mission College,India,,,
3400,St Paul's College,India,,,
3401,St Thomas College of Engineering,India,,,
3403,Sumandeep Vidhyapeeth University,India,,,
3404,SV College of Engineering & Technology,India,,,
3406,Swargiya Dadasaheb Kalmegh Smruti,India,,,
3407,Swarnandhra Institute of Engineering & Technology,India,,,
3408,Symbiosis Institute of Telecom Management,India,,,
3412,Tamil Nadu National Law School,India,,,
3414,Techno India Batanagar,India,,,
3415,Techno India College of Technology,India,,,
3416,Teegala Krishna Reddy Engineering College,India,,,
3417,Terna Engineering College,India,,,
3418,Tessellate College of Architecture Trivandrum,India,,,
3419,Thassim Beevi Abdul Kader College For Women,India,,,
3421,TRP Engineering College,India,,,
3423,ULTRA College of Engineering & Technology,India,,,
3424,Unity Degree College,India,,,
3426,University Institute,India,,,
3427,University Institute of Information Technology Himachal Pradesh University,India,,,
3432,V Parekh Technical Institute,India,,,
3433,V Raman Global University,India,,,
3434,V S Institute of Technology,India,,,
3438,Victoria Institution College,India,,,
3439,Vidya Bharathi Institute of Technology,India,,,
3440,Vidyabharti Mahavidyalaya,India,,,
3441,Vignan's Institute of Technology & Aeronautical Engineering,India,,,
3443,Vishwakarma Institute of Management,India,,,
3444,Vivek College,India,,,
3445,Vivekananda College of Engineering & Technology,India,,,
3455,YIT Younus Institute of Technology YCK,India,,,
3457,Yogananda Institute of Technology & Science,India,,,
3458,Zakirhusain PG Evening College,India,,,
3461,Bayan University,Iraq,,,
3464,Ibn Hayyan University College,Iraq,,,
3466,Middle Technical University,Iraq,,,
3467,Osol Al Deen University College,Iraq,,,
3470,Agriculture Higher Education Center of Khorasan Razavi,Iran,,,
3474,Aria University of Sciences & Sustainability,Iran,,,
3476,Azarbaijan Shahid Madani University Tarbiat Moallem,Iran,,,
3477,B A Institute of Higher Education,Iran,,,
3485,Daneshmand Higher Education Institute,Iran,,,
3486,East Azarbayjan Islamic Azad University Science & Research,Iran,,,
3488,Faculty of Science & Applied Telecommunications,Iran,,,
3489,Farabi Institute of Higher Education Graduate School of Management,Iran,,,
3490,Farhangyan University,Iran,,,
3492,Ghazali University,Iran,,,
3493,Golestan Higher Education Institute,Iran,,,
3497,Hatef University,Iran,,,
3498,Higher Education Institute Nedaye Danesh,Iran,,,
3504,Institute for Higher Education Ganjnameh,Iran,,,
3505,Institute for Higher Education Ghiyathoddin Jamshid Kashani,Iran,,,
3507,Institute of Higher Education Agriculture,Iran,,,
3509,Iran Management & Productivity Study Center,Iran,,,
3542,Islamic Azad University Fars Science & Research,Iran,,,
3545,Islamic Azad University Frieden,Iran,,,
3548,Islamic Azad University Gilanegharb,Iran,,,
3554,Islamic Azad University Hormoz,Iran,,,
3557,Islamic Azad University International Center for Persian Gulf,Iran,,,
3559,Islamic Azad University Jasb,Iran,,,
3595,Islamic Azad University Nevsehir,Iran,,,
3598,Islamic Azad University of Lashenesha Zibakenar,Iran,,,
3614,Islamic Azad University Savadkooh,Iran,,,
3619,Islamic Azad University Shawl,Iran,,,
3623,Islamic Azad University Songhor & Keliai Center,Iran,,,
3633,Islamic Azad University West Porch,Iran,,,
3635,Islamic Azad University Zahdshhr,Iran,,,
3639,Islamic Azad University Zone 9,Iran,,,
3643,Kadvs Institute of Higher Education,Iran,,,
3646,Lamei University,Iran,,,
3649,Mehr Institute of Higher Education,Iran,,,
3651,Molana Institute of Higher Education,Iran,,,
3653,North Institute of Higher Education,Iran,,,
3656,Payam Khorasan Razavi University,Iran,,,
3657,Payam Noor University,Iran,,https://pnu.ac.ir/,
3663,Payam Noor University Fern,Iran,,,
3667,Payam Noor University Gonbad Kavoos,Iran,,,
3672,Payam Noor University of Mazandaran,Iran,,,
3673,Payam Noor University Oz,Iran,,,
3674,Payam Noor University PolSefid,Iran,,,
3695,Sana Institute of Higher Education,Iran,,,
3696,Science & Arts University,Iran,,,
3697,Sepahan Institute of Higher Education,Iran,,,
3702,Subhan Institute of Higher Education,Iran,,,
3703,Tabarestan Institute of Higher Education,Iran,,,
3709,University of Applied Science & Technology Unit 31,Iran,,,
3726,Bifrost University,Iceland,,,
3731,Arrigo Boito State Conservatory of Music,Italy,,,
3732,Brera Academy Of Fine Arts,Italy,,,
3739,Ecampus Telematic University,Italy,,,
3740,F Casati High School for Linguistic Mediators,Italy,,,
3742,Free Mediterranean University Jean Monnet Lum,Italy,,,
3745,Gabriele D&#039;annunzio University Of Chieti &amp; Pescara,Italy,,,
3746,High School for Linguistic Mediators Padua,Italy,,,
3747,Higher Institute for Artistic Industries,Italy,,,
3751,Higher School of Linguistic Mediators San Pellegrino University Foundation,Italy,,,
3752,Humanitas University,Italy,,,
3754,International School for Advanced Studies,Italy,,,
3758,Luigi Vanvitelli University Of Campania,Italy,,,
3761,New Academy of Fine Arts Futurarium,Italy,,,
3763,Pegaso Telematic University,Italy,,,
3769,Pontifical Urbaniana University,Italy,,,
3776,Uninettuno International Telematic University,Italy,,,
3790,University Of Roma Tre,Italy,,,
3793,University Of Telematic Merchants University Of The Italian Chambers Of Commerce,Italy,,,
3795,University Of Tuscia,Italy,,,
3797,Caribbean Maritime Institute,Jamaica,,,
3798,Caribbean Maritime University,Jamaica,,,
3804,Bunri Sato Gakuen University of Hospitality,Japan,,,
3819,Hokuyo University,Japan,,,
3822,Japan Marine Technical College,Japan,,,
3826,Kacho Junior College,Japan,,,
3841,Kyushu Nutrition Welfare University,Japan,,,
3843,Marine Technical College,Japan,,,
3850,Nara Bunka Women's College,Japan,,,
3855,Nihonbashigakkan University,Japan,,,
3860,Nishi Kyushu University,Japan,,,
3871,Seibi University,Japan,,,
3876,Shoin Higashi Junior Women's College,Japan,,,
3878,St Thomas University,Japan,,,
3880,Teikyo University,Japan,,,
3884,Tokiwakai College,Japan,,,
3901,Yuge National College of Maritime Technology,Japan,,,
3903,Co operative University College of Kenya,Kenya,,,
3904,Institute of Advanced Technology Kenya,Kenya,,,
3909,Kibabii University College,Kenya,,,
3912,Murang'a University College,Kenya,,,
3916,Tangaza College,Kenya,,,
3923,Kyrgyz National Academy of Artists Acad T Sadykova,Kyrgyzstan,,,
3949,Chunnam Techno University,South Korea,,,
3954,Dong U College,South Korea,,,
3959,Gyeongbuk College of Health,South Korea,,,
3970,Korea International Culture University of Graduate,South Korea,,,
3971,Korea University of International Studies,South Korea,,,
3972,Korea University of Media Arts,South Korea,,,
3973,Kyungb Hee Cyber University,South Korea,,,
3975,Luther Theological University,South Korea,,,
3981,Seoyeng University,South Korea,,,
3984,Sung Duk College,South Korea,,,
3991,Yeungjin College,South Korea,,,
3993,Youngnam Foreign Language College,South Korea,,,
3998,Asfendiyarov Kazakh National Medical University,Kazakhstan,,,
4002,Caspian State University of Technology & Engineering Sh Yesenov,Kazakhstan,,,
4003,Caspian University,Kazakhstan,,,
4004,Central Asian Academy,Kazakhstan,,,
4005,Central Kazakhstan Academy Science & Education Centre Lingua,Kazakhstan,,,
4007,Eurasian University of Technology,Kazakhstan,,,
4008,Financial Academy,Kazakhstan,,,
4009,International Education Corporation,Kazakhstan,,,
4010,Karaganda Economical University Of Kazpotrebsoyuz,Kazakhstan,,,
4011,Karaganda Law Academy B Beisenov of Ministry of Internal Affairs,Kazakhstan,,,
4014,Kazakh Academy of Transport & Communication M Tynyshbayev,Kazakhstan,,,
4015,Kazakh Economic University,Kazakhstan,,,
4016,Kazakh National Agrarian University,Kazakhstan,,,
4018,Kazakh Russian University,Kazakhstan,,,
4019,Kazakh State Women Pedagogical University,Kazakhstan,,,
4020,Kazakhstan Innovation University,Kazakhstan,,,
4023,Modern Humanities Technical Institute,Kazakhstan,,,
4030,South Kazakhstan Pedagogical University,Kazakhstan,,,
4031,South Kazakhstan State Medical Academy,Kazakhstan,,,
4037,West Kazakhstan Engineering & Humanities University,Kazakhstan,,,
4038,West Kazakhstan State University M Otemisov,Kazakhstan,,,
4039,Zhubanov University,Kazakhstan,,,
4040,College of Health Technology,Laos,,,
4042,Antonine University,Lebanon,,,
4043,City University CITYU,Lebanon,,,
